Michigan,21,851220,ELECT LIGHTING/VISUAL SIGNLNG EQ EX FOR BICYC,303.88,271.44,324.12,361.67
Michigan,22,391000,"SILICONES, IN PRIMARY FORMS",262,276.68,243.86,331.95
Michigan,23,870870,ROAD WHEELS & PTS & ACCESSORIES FOR MOTOR VEH,447.77,423,413.98,326.51
Michigan,24,392690,"ARTICLES OF PLASTICS, NESOI",317.21,327.47,291.19,322.35
Michigan,25,853710,CONTROLS ETC W ELECT APPR F ELECT CONT NOV 10,291.66,300,358.12,322.07
Minnesota,0,0,World,20760.14,21397.6,20016.17,19202.45
Minnesota,0,25,Top 25,5961.64,6627.3,6171.58,5926.5
Minnesota,1,901839,"MED NEEDLES. NESOI, CATHERERS ETC AND PARTS E",772.96,875,863.87,810.28
Minnesota,2,880000,"CIVILIAN AIRCRAFT, ENGINES, AND PARTS",600.05,518.42,452.97,489.21
Minnesota,3,842199,FILTER/PURIFY MACHINE & APPARATUS PARTS,340.71,370.94,412.35,334.04
Minnesota,4,854290,ELECTRONIC INTEGRATED CIRCUITS AND MCRSSMBLS,388.32,430.86,347.86,331.5
Minnesota,5,851762,MACH FOR RECP/CONVR/TRANS/REGN OF VOICE/IMAGE,341.97,322.07,332.27,297.66
Minnesota,6,391990,"PLATES, SHEETS, FILM ETC, PLASTICS, SELF-ADH",289.77,294.55,297.72,293.74
Minnesota,7,902190,OTH ARTIFICAL PTS OF THE BODY & PTS & ACCESSO,344.35,308.12,297.33,291.89
Minnesota,8,901890,"INSTR & APPL F MEDICAL SURGICAL DENTAL VET, N",203.69,232.1,251.2,268.52
Minnesota,9,870310,PASS VEH FOR SNOW; GOLF CARTS & SIMILAR VEHIC,382.2,359.41,269.28,217.31
Minnesota,10,900190,LENSES PRISMS MIRRORS OPTCL ELMNT N OPTICALLY,133.48,255.97,278.32,207.5
Minnesota,11,870321,"PASS MTR VEH, SPARK IGN ENG, NOT OV 1,000 CC",366.8,418.06,316.42,206.29
Minnesota,12,120190,"SOYBEANS, NESOI",141.26,227.45,174.4,188.61
Minnesota,13,901819,"ELECTRO-DIAGNOSTIC APPARATUS NESOI, AND PARTS",109.98,133.95,170.93,187.05
Minnesota,14,470200,"CHEMICAL WOODPULP, DISSOLVING GRADES",137.3,287.1,181.71,186.89
Minnesota,15,100590,"CORN (MAIZE), OTHER THAN SEED CORN",112.11,195.56,126.47,169.82
Minnesota,16,870899,"PARTS AND ACCESSORIES OF MOTOR VEHICLES, NESO",69.9,96.58,80.13,166.46
Minnesota,17,392690,"ARTICLES OF PLASTICS, NESOI",106.63,130.14,139.76,158.53
Minnesota,18,230400,"SOYBEAN OILCAKE & OTH SOLID RESIDUE, WH/NOT G",209.81,137.09,178.31,147.19
Minnesota,19,847989,MACH & MECHANICAL APPL W INDIVIDUAL FUNCTION,140.77,165.48,144.76,146.66
Minnesota,20,902620,"INST & APPRTS, MEASURING/CHECKING PRESSURE",171.78,174.41,170.32,142.26
Minnesota,21,230990,"ANIMAL FEED PREP EXCEPT DOG OR CAT FOOD, RETA",82.25,100.85,128.44,142.17
Minnesota,22,900120,SHEETS AND PLATES OF POLARIZING MATERIAL,83.39,110.67,125.32,139.05
Minnesota,23,902750,INSTRUMENTS ETC USING OPTICAL RADIATIONS NESO,135.62,132.36,136.58,138.67
Minnesota,24,842420,SPRAY GUNS AND SIMILAR APPLIANCES,203.98,221.97,165.62,134.71
Minnesota,25,903180,"MEAS & CHECKNG INSTRUMENT, APPLIANCES & MACH",92.57,128.21,129.24,130.48
Missouri,0,0,World,12958.22,14189.64,13647.81,13934.62
Missouri,0,25,Top 25,4275.68,5288.68,5260.84,6475.05
Missouri,1,870431,"MTR VEH TRANS GDS SPK IG IN C P ENG, GVW NOV",1280.51,1450.89,1155.84,1542.94
Missouri,2,880000,"CIVILIAN AIRCRAFT, ENGINES, AND PARTS",86.43,495.54,685.82,1327.78
Missouri,3,871150,"MOTORCYCLES, CYCL,EXCD 800 CC",254.22,267.5,237.55,335.38
Missouri,4,300230,VACCINES FOR VETRINARY MEDICINE,381.27,333.02,336.91,317.93
Missouri,5,230400,"SOYBEAN OILCAKE & OTH SOLID RESIDUE, WH/NOT G",68.51,240.31,262.11,273.42
Missouri,6,100590,"CORN (MAIZE), OTHER THAN SEED CORN",109.88,167.81,231.98,231.74
Missouri,7,120190,"SOYBEANS, NESOI",138.18,161.34,164.37,215.13
Missouri,8,410411,"BOV/EQ HIDE/SKIN,FUL GRN,UNSPLIT;GRN SPL, WET",125,198.17,204.63,173.5
Missouri,9,210690,FOOD PREPARATIONS NESOI,179.67,198.09,173.56,165.37
Missouri,10,930690,BOMB MINES OT AMMNTION PROJCTIONS ETC AND PAR,72.71,144,191.9,161.01
Missouri,11,300210,"ANTISERA, BLOOD FRACTIONS & IMMUNOLOGICAL PRO",46.98,84.3,73.23,152.87
Missouri,12,293399,HETEROCYCLIC COMP W NITROGEN HETERO-ATM ONLY,116.91,185.53,243.87,146.89
Missouri,13,20319,"MEAT OF SWINE, NESOI, FRESH OR CHILLED",139.38,140.45,126.29,141.77
Missouri,14,220300,BEER MADE FROM MALT,76.4,89.2,146.51,131.01
Missouri,15,293339,CMPDS CONT AN UNFUSED PYRIDINE RING ETC NESOI,128.67,134.18,156.39,128.8
Missouri,16,880330,"PARTS OF AIRPLANES OR HELICOPTERS, NESOI",352.63,210.46,105.19,124.89
Missouri,17,300490,"MEDICAMENTS NESOI, MEASURED DOSES, RETAIL PK",55.92,72.96,110.71,123.6
Missouri,18,382490,"PRODUCTS AND RESIDUALS OF CHEMICAL INDUSTRY,",30.63,65.9,106.18,119.19
Missouri,19,20329,"MEAT OF SWINE, NESOI, FROZEN",184.22,181.72,112.91,111.96
Missouri,20,260700,LEAD ORES AND CONCENTRATES,15.96,13.24,0,110.48
Missouri,21,850720,LEAD-ACID STORAGE BATTERIES NESOI,126.65,134.78,113.32,95.02
Missouri,22,230910,"DOG AND CAT FOOD, PUT UP FOR RETAIL SALE",80.82,94.92,98.81,92.01
Missouri,23,490199,"PRINTED BOOKS, BROCHURES, ETC., NESOI",88.63,80.24,73.07,85.65
Missouri,24,840790,"SPARK-IGNTN RCPRCTNG/ROTARY INT COMBSTN ENG,",85.62,88.99,91.29,84.5
Missouri,25,870421,"TRUCKS, NESOI, DIESEL ENG, GVW 5 METRIC TONS",49.85,55.12,58.4,82.21
Mississippi,0,0,World,12415.15,11484.93,10848.36,10494.72
Mississippi,0,25,Top 25,8309.65,7725.22,7183.71,7001.41
Mississippi,1,271019,PETROL OIL BITUM MINERAL (NT CRUD) ETC NT BIO,3057.7,2970.04,2381.19,1911.88
Mississippi,2,271012,"LT OILS, PREPS GT=70% PETROLEUM/BITUM NT BIOD",1148.95,887.92,850.02,721.35
Mississippi,3,320611,"PIGMNTS\PREPS CONT =>80% TITANIUM DIOXIDE, DR",795.73,792.46,650.44,707.7
Mississippi,4,470321,"CHEMICAL WOODPULP, SODA ETC. N DIS S BL & BL",512.73,468.04,471.44,449.33
Mississippi,5,870324,PASS VEH SPK-IG INT COM RCPR P ENG > 3000 CC,223.44,202.07,434.73,412.09
Mississippi,6,902131,ARTIFICIAL JOINTS AND PARTS AND ACCESSORIES T,176.52,292.48,352.19,281.82
Mississippi,7,520100,"COTTON, NOT CARDED OR COMBED",550.78,378,296.34,279.99
Mississippi,8,901890,"INSTR & APPL F MEDICAL SURGICAL DENTAL VET, N",94.57,135.85,171.84,256.96
Mississippi,9,901839,"MED NEEDLES. NESOI, CATHERERS ETC AND PARTS E",158.87,174,186.53,230.84
Mississippi,10,870431,"MTR VEH TRANS GDS SPK IG IN C P ENG, GVW NOV",267.85,251.01,197.35,211.31
Mississippi,11,890520,"FLOATING OR SUBMERSIBLE DRILLING OR PRODCTN,P",0,11.08,143,209.46
Mississippi,12,870323,PASS VEH SPK-IG INT COM RCPR P ENG >1500 NOV,270.36,192,187.27,201.4
Mississippi,13,880000,"CIVILIAN AIRCRAFT, ENGINES, AND PARTS",144.36,163.36,96.21,178.13
Mississippi,14,848120,VALVES F OLEOHYDRAULIC OR PNEUMATIC TRANSMISS,66.49,149.61,137.27,157.56
Mississippi,15,854239,"ELECTRONIC INTEGRATED CIRCUITS, NESOI",116.05,92.42,85.67,102.64
Mississippi,16,902110,"ORTHOPEDIC OR FRACTRE APPLIANCES, PARTS & ACC",29.91,70.27,101.5,91.36
Mississippi,17,20714,"CHICKEN CUTS AND EDIBLE OFFAL (INC LIVERS), F",224.16,161.66,76.06,74.96
Mississippi,18,870421,"TRUCKS, NESOI, DIESEL ENG, GVW 5 METRIC TONS",0.23,0,0.78,74.82
Mississippi,19,851762,MACH FOR RECP/CONVR/TRANS/REGN OF VOICE/IMAGE,25.73,27.25,25.17,71.75
Mississippi,20,871000,"TANK & OT ARMORED FIGHT VEH, MOTORIZED; AND P",0.06,0.35,0.07,67.57
Mississippi,21,480411,"KRAFTLINER, UNCOATED UNBLEACHED IN ROLLS OR S",118.08,108.4,104.5,64.91
Mississippi,22,271311,"PETROLEUM COKE, NOT CALCINED",82.79,102.49,77.76,63.03
Mississippi,23,846729,"TOOLS FOR WK IN  HAND,W/ SELF-CONT ELEC MOTOR",42.57,14.01,49.23,62.71
Mississippi,24,854231,"PROCESSORS AND CONTROLLERS, ELECTRONIC INTEG",91.38,80.42,63.78,60.37
Mississippi,25,290243,PARA-XYLENE,110.33,0,43.36,57.49
Montana,0,0,World,1505.8,1544.91,1404.09,1360.1
Montana,0,25,Top 25,885.12,940.98,924.85,1000.89
Montana,1,240220,CIGARETTES CONTAINING TOBACCO,33.91,52.72,119.39,185.26
Montana,2,880000,"CIVILIAN AIRCRAFT, ENGINES, AND PARTS",14.45,22.11,19.56,96.37
Montana,3,71340,"LENTILS, DRIED SHELLED, INCLUDING SEED",30.4,37.82,52.71,95.97
Montana,4,282550,COPPER OXIDES AND HYDROXIDES,118.23,122.43,147.66,95.54
Montana,5,848620,MACHINES FOR MAN. SEMICONDUTOR DEVICES/ELEC I,40.31,35.32,74.21,79.54
Montana,6,285000,HYDRIDS/NITRIDS/AZIDS/SILICIDS ETC W/NT CHEM,60.74,84.06,67.61,62.01
Montana,7,71310,"PEAS, DRIED SHELLED, INCLUDING SEED",38.56,48.53,40.01,40.83
Montana,8,280461,SILICON CONTAIN BY WT NT < 99.99% OF SILICON,33.2,32.42,38.93,38.43
Montana,9,252329,PORTLAND CEMENT EXCEPT WHITE PORTLAND CEMENT,39.04,42.74,37.5,35.6
Montana,10,271012,"LT OILS, PREPS GT=70% PETROLEUM/BITUM NT BIOD",84.72,63.67,26.74,35.52
Montana,11,252620,"NATURAL STEATITE AND TALC, CRUSHED OR POWDERE",23.73,25.37,26.11,26.51
Montana,12,300290,"HUMAN BLOOD; ANIMAL BLOOD PREP, TOXINS, CULTR",50.94,25.25,34.54,23.43
Montana,13,71320,"CHICKPEAS (GARBANZOS), DRIED SHELLED, INCLUDE",9.59,7.01,4.3,20.88
Montana,14,110710,"MALT, NOT ROASTED",17.37,14.35,12,20.05
Montana,15,270119,"COAL NESOI, NOT AGGLOMERATED",144.22,137.94,123.55,19.18
Montana,16,270112,"BITUMINOUS COAL, NOT AGGLOMERATED",74.21,85.19,0,16.7
Montana,17,848690,"PARTS & ACCSESORIES FOR MACH TO MAN. SEMICNT,",13.84,13.51,14.56,16.07
Montana,18,100199,"WHEAT AND MESLIN, NESOI",17.77,40.02,12.23,13.51
Montana,19,382200,"COMPOSITE DIAGNOSTIC/LAB REAGENTS, EXC PHARMA",2.51,2.58,6.13,13
Montana,20,252210,QUICKLIME,0.71,9.47,16.09,12.61
Montana,21,270900,CRUDE OIL FROM PETROLEUM AND BITUMINOUS MINER,5.24,1.43,3.18,12.01
Montana,22,901849,"INST & APPLN FOR DENTAL SCIENCE, & PTS & ACC,",3.76,5.03,16.19,11.13
Montana,23,190219,"PASTA, UNCOOKED, NOT STUFFED ETC., NESOI",19.47,19.33,16.79,10.59
Montana,24,441114,"MEDIUM DENSITY FIBERBOARD, OF A THICKNESS GT",7.95,8.45,9.13,10.37
Montana,25,285300,INORG CMPDS NESOI;LQ/CMPRSD AIR;AMALG EXC PRE,0.25,4.23,5.72,9.77
North Carolina,0,0,World,29347.12,31420,30201.81,30161.26
North Carolina,0,25,Top 25,8687.86,10271.2,9763.83,11090.52
North Carolina,1,880000,"CIVILIAN AIRCRAFT, ENGINES, AND PARTS",1057.63,1199.42,1265.66,1418.49
North Carolina,2,300210,"ANTISERA, BLOOD FRACTIONS & IMMUNOLOGICAL PRO",465.36,491.44,709.84,1409
North Carolina,3,300490,"MEDICAMENTS NESOI, MEASURED DOSES, RETAIL PK",824.37,1174.07,960.93,1214.53
North Carolina,4,880330,"PARTS OF AIRPLANES OR HELICOPTERS, NESOI",86.87,140.7,524.74,993.73
North Carolina,5,240120,"TOBACCO, PARTLY OR WHOLLY STEMMED/STRIPPED",728.29,746.51,712.31,689.07
North Carolina,6,470321,"CHEMICAL WOODPULP, SODA ETC. N DIS S BL & BL",573.54,641.43,597.38,659.41
North Carolina,7,870120,ROAD TRACTORS FOR SEMI-TRAILERS,616.45,465.88,553.35,400.48
North Carolina,8,520512,"COT YARN, 85% COT, NO RETAIL, OV 14NM NOT OV",452.87,457.37,386.67,329.93
North Carolina,9,854140,PHOTOSNSITVE SEMICNDCTR DVICE INC PHTVLTC CEL,437.35,541.17,409.67,328.03
North Carolina,10,847590,PARTS OF MACH FOR ASSMBL ELEC LAMP ETC MFG GL,247.77,380.83,227.34,276.92
North Carolina,11,903289,"AUTO REGULATING INS & APPR EX THROSTAT,MNSTAT",191.71,217.77,240.21,268.48
North Carolina,12,20329,"MEAT OF SWINE, NESOI, FROZEN",302.94,376.29,245.18,262.48
North Carolina,13,854470,INSULATED OPTICAL FIBER CABLES WITH INDVULY S,220.44,335.12,286.63,258.96
North Carolina,14,840820,COMPRESSION-IGNTN INT COMBUSTION PISTON ENGIN,235.42,377.87,355.8,245.78
North Carolina,15,240220,CIGARETTES CONTAINING TOBACCO,267.66,259.46,241.27,241.17
North Carolina,16,900110,"OPTICAL FIBERS, OPTICAL FIBER BUNDLES AND CAB",265.86,225.63,210.17,240.24
North Carolina,17,842951,"MECH FRONT-END SHOVEL LOADERS, SELF-PROPELLED",321.59,346.39,316.63,229.54
North Carolina,18,520513,"COT YARN, 85% COT, NO RETAIL, OV 43NM NOT OV",106.21,127.59,183.6,227.22
North Carolina,19,930690,BOMB MINES OT AMMNTION PROJCTIONS ETC AND PAR,54.23,439.55,56.93,223.83
North Carolina,20,550953,YRN N SW TH SYN ST FB N RT SL PLY S F MIX M/S,273.61,274.46,273.56,222.34
North Carolina,21,381512,SUPPORTED CATALYSTS W PREC METAL/PREC MTL COM,98.79,235.07,228.26,219.78
North Carolina,22,20714,"CHICKEN CUTS AND EDIBLE OFFAL (INC LIVERS), F",237.13,289.49,202.11,193.61
North Carolina,23,870899,"PARTS AND ACCESSORIES OF MOTOR VEHICLES, NESO",179.47,156.78,189.18,183.94
North Carolina,24,848180,TAPS COCKS ETC F PIPE VAT INC THERMO CONTROL,212.93,194.07,213.7,179.06
North Carolina,25,280920,PHOSPHORIC ACID AND POLYPHOSPHORIC ACIDS,229.35,176.84,172.73,174.5
North Dakota,0,0,World,4401.7,5513.08,4026.78,5313.34
North Dakota,0,25,Top 25,3365.39,4389.02,3042.86,4485.51
North Dakota,1,270900,CRUDE OIL FROM PETROLEUM AND BITUMINOUS MINER,1393.46,2372.97,1352.19,2892.61
North Dakota,2,271012,"LT OILS, PREPS GT=70% PETROLEUM/BITUM NT BIOD",196.54,300.14,232.78,199.23
North Dakota,3,842951,"MECH FRONT-END SHOVEL LOADERS, SELF-PROPELLED",274.56,296.45,248.54,175.3
North Dakota,4,220720,ETHYL ALCOHOL & OTH SPIRITS DENATURED ANY STR,105.16,89.38,69.66,108.84
North Dakota,5,100199,"WHEAT AND MESLIN, NESOI",109.98,140.72,170.36,104.11
North Dakota,6,870130,TRACK-LAYING TRACTORS,144.2,148.26,96.16,103.68
North Dakota,7,870190,"TRACTORS, NESOI",163.94,144.86,94.52,93.93
North Dakota,8,100590,"CORN (MAIZE), OTHER THAN SEED CORN",75.67,27.74,82.13,89.29
North Dakota,9,382600,BIODIESEL AND MIXES CONTAIN LT 70% PETROL OIL,155.87,112.07,58.34,69.99
North Dakota,10,230330,"BREWING OR DISTILLING DREGS AND WASTE, W/NT P",81.64,77.2,61.95,66.33
North Dakota,11,843230,"SEEDERS, PLANTERS AND TRANSPLANTERS",123.14,69.47,55.69,63.37
North Dakota,12,290110,"ACYCLIC HYDROCARBONS, SATURATED",59.02,34.22,67.82,60.98
North Dakota,13,71340,"LENTILS, DRIED SHELLED, INCLUDING SEED",17.61,26.09,32.23,44.28
North Dakota,14,271113,"BUTANES, LIQUEFIED",63.29,138.34,62.27,43.77
North Dakota,15,120510,LOW ERUCIC ACID RAPE/COLZA SEEDS W/NOT BROKEN,28.42,27.47,44.88,42.73
North Dakota,16,71339,"BEANS NESOI, DRIED SHELLED, INCLUDING SEED",41.56,33.12,22.99,41.84
North Dakota,17,842952,MECH SHOVELS EXCAVATORS ETC W 360 DEGREE SPRS,59.66,60.26,57.4,40.09
North Dakota,18,230400,"SOYBEAN OILCAKE & OTH SOLID RESIDUE, WH/NOT G",2.3,2.79,29.6,38.47
North Dakota,19,71310,"PEAS, DRIED SHELLED, INCLUDING SEED",44.13,40.06,37.36,37.92
North Dakota,20,110710,"MALT, NOT ROASTED",67.92,60.13,51.45,37.65
North Dakota,21,271019,PETROL OIL BITUM MINERAL (NT CRUD) ETC NT BIO,1.16,1.47,12.68,31.89
North Dakota,22,843290,AGRIC HORT/FOREST MACHY & LAWN/GROUND ROLLER,23.5,26.36,20.2,25.73
North Dakota,23,151411,"RAPESEED/COLZA OIL & FRACTIONS, LW ERUCIC ACI",62.71,27.46,11.38,24.79
North Dakota,24,120190,"SOYBEANS, NESOI",48.85,108.54,45.28,24.43
North Dakota,25,843139,"PTS FOR LIFTING, HNDLNG, LOADING/UNLDNG MACH",21.1,23.46,25.01,24.28
Nebraska,0,0,World,7392.99,7889.68,6663.4,6380.35
Nebraska,0,25,Top 25,4328.87,4891.19,4080.94,4076.54
Nebraska,1,20130,"MEAT OF BOVINE ANIMALS, BONELESS, FRESH OR CH",490.07,532.28,489.2,487.98
Nebraska,2,20230,"MEAT OF BOVINE ANIMALS, BONELESS, FROZEN",321.07,433.59,376.73,378.09
Nebraska,3,100590,"CORN (MAIZE), OTHER THAN SEED CORN",144.18,194.66,229.58,343.97
Nebraska,4,120190,"SOYBEANS, NESOI",422.04,518.22,314.91,337.87
Nebraska,5,843351,COMBINE HARVESTER-THRESHERS,580.59,465.96,308.52,324.5
Nebraska,6,410150,"WHOLE HIDES & SKINS, OF A WT >16KG BOVINE/EQU",258.04,313.52,258.87,255.79
Nebraska,7,842481,AGRICULTURAL OR HORTICULTURAL MECH SPRAYERS E,284.73,240.57,190.67,164.31
Nebraska,8,20329,"MEAT OF SWINE, NESOI, FROZEN",132.76,224.73,170.03,157.86
Nebraska,9,230400,"SOYBEAN OILCAKE & OTH SOLID RESIDUE, WH/NOT G",30.3,44.74,63.99,154.28
Nebraska,10,20319,"MEAT OF SWINE, NESOI, FRESH OR CHILLED",142.89,142.67,146.6,144.27
Nebraska,11,901831,"SYRINGES, WITH OR WITHOUT NEEDLES; PTS & ACCE",130.03,111.86,95.53,132.58
Nebraska,12,300230,VACCINES FOR VETRINARY MEDICINE,163.73,156.79,149.52,131.98
Nebraska,13,170260,"FRUCTOSE, NESOI & SYRUP, OV 50% FRUCTOSE IN D",54.47,67.83,68.29,118.35
Nebraska,14,853690,ELECT APPR F PRTCT TO ELECT CIRCT NOV 1000 V,58.19,122.26,174.87,114
Nebraska,15,410411,"BOV/EQ HIDE/SKIN,FUL GRN,UNSPLIT;GRN SPL, WET",162.01,201.63,142.94,111.32
Nebraska,16,271121,"NATURAL GAS, GASEOUS",404.59,476.52,173.52,99.05
Nebraska,17,20220,"MEAT, BOVINE CUTS WITH BONE IN, FROZEN",101.07,136.09,102.26,95.26
Nebraska,18,230990,"ANIMAL FEED PREP EXCEPT DOG OR CAT FOOD, RETA",172.74,124.88,118.4,84.27
Nebraska,19,380891,"INSECTICIDES, EXC THOSE SPECIFIED IN SUBHEAD.",73.71,90.62,65.87,80.56
Nebraska,20,853890,PT F ELECT APPR F ELECT CIRCT; F ELCT CONTRL,37.94,88.59,188.11,74.93
Nebraska,21,20610,"OFFAL OF BOVINE ANIMALS, EDIBLE, FRESH OR CHI",27.16,39.19,47.51,62.78
Nebraska,22,842490,PTS FOR MECHANICAL APPLIANCE PROJECT LIQUID E,33.7,36.2,44.83,56.97
Nebraska,23,380892,"FUNGICIDES, EXC THOSE SPECIFIED IN SUBHEAD. N",78.97,67.41,62.1,56.43
Nebraska,24,250100,"SALT INCL TBL/DENTRD, PURE SODM CHLOR ETC; SE",0.08,28.6,48.78,54.89
Nebraska,25,50400,"ANIMAL (NOT FISH) GUTS, BLADDERS, STOMACHS &",23.83,31.78,49.3,54.25
New Hampshire,0,0,World,3511.05,4233.17,4001.33,4143.02
New Hampshire,0,25,Top 25,1159.72,1640.19,1813.2,2073.67
New Hampshire,1,880000,"CIVILIAN AIRCRAFT, ENGINES, AND PARTS",55.26,69.28,75.87,235.1
New Hampshire,2,844399,"PTS & ACC OF PRINTERS, COPIERS AND FAX MACH,",142.37,173.25,203.24,231.27
New Hampshire,3,854470,INSULATED OPTICAL FIBER CABLES WITH INDVULY S,8.15,3.94,156.81,165.25
New Hampshire,4,851712,PHONES FOR CELLULAR NTWKS OR FOR OTH WIRELESS,179.68,502.89,288.2,156.42
New Hampshire,5,851762,MACH FOR RECP/CONVR/TRANS/REGN OF VOICE/IMAGE,34.7,49.09,128.81,155.09
New Hampshire,6,851770,PTS OF PHONE SETS & OTH APP FOR THE TRANS/REC,66.34,124.64,179.56,137.28
New Hampshire,7,846693,PARTS AND ACCESSORIES FOR USE WITH MACH TOOL,145.81,158.36,141.17,130.25
New Hampshire,8,300390,"MEDICAMENTS NESOI, NOT IN DOSAGE FORM ETC",2.96,20.12,9,125.64
New Hampshire,9,841370,"CENTRIFUGAL PUMPS, NESOI",0.05,0.21,80.56,78.82
New Hampshire,10,711299,WASTE AND SCRAP OF PRECIOUS METAL NESOI,39.42,35.67,63.44,64.39
New Hampshire,11,392690,"ARTICLES OF PLASTICS, NESOI",34.14,47.49,49.25,59.11
New Hampshire,12,844332,"PRINTERS/ COPIERS/FAX MACH, NT COMB, CONNCT T",65.83,88.96,84.52,57.8
New Hampshire,13,900510,BINOCULARS,19.69,20.76,13.44,57.1
New Hampshire,14,845690,"MACH TOOL,WRK ANY MATERIAL BY REMOVAL OF MATR",56.07,61.82,53.79,51.58
New Hampshire,15,930200,"REVOLVERS & PISTOLS, DESIGNED TO FIRE LIVE AM",22.46,19.72,18.43,41.5
New Hampshire,16,901580,"SURVEYING INSTRUMENTS AND APPLIANCES, NESOI E",64.09,39.23,39.58,37.25
New Hampshire,17,853921,TUNGSTEN HALOGEN ELECTRIC FILAMENT LAMPS,38.85,35.04,31.02,36.1
New Hampshire,18,853400,PRINTED CIRCUITS,61.88,49.42,37,34.47
New Hampshire,19,401693,"GASKET, WASHERS & OTHER SEALS, OF VULCANIZED",20.75,27.47,36.15,34.28
New Hampshire,20,840140,PARTS OF NUCLEAR REACTORS,0,0.02,0.12,32.92
New Hampshire,21,901380,"OPTICAL DEVICES, APPLIANCES AND INSTRUMENTS,",8.08,10.66,21.62,32.68
New Hampshire,22,854449,INSULATED ELECTRIC CONDUCTORS =< 80 V NESOI,31.14,36.14,32.28,32.12
New Hampshire,23,901839,"MED NEEDLES. NESOI, CATHERERS ETC AND PARTS E",30.11,23.41,24.85,29.93
New Hampshire,24,180690,"COCOA PREPARATIONS, NOT IN BULK FORM, NESOI",29.34,36.97,30.63,29.44
New Hampshire,25,870899,"PARTS AND ACCESSORIES OF MOTOR VEHICLES, NESO",2.55,5.63,13.85,27.89
New Jersey,0,0,World,36611.87,36586.97,32063.57,31222.79
New Jersey,0,25,Top 25,14158.84,14243.84,11150.11,11695.81
New Jersey,1,271019,PETROL OIL BITUM MINERAL (NT CRUD) ETC NT BIO,3748.97,2882.33,1245.36,1741.99
New Jersey,2,880000,"CIVILIAN AIRCRAFT, ENGINES, AND PARTS",637.06,591.56,721.13,732.11
New Jersey,3,851712,PHONES FOR CELLULAR NTWKS OR FOR OTH WIRELESS,313.92,695.9,655.35,653.32
New Jersey,4,711319,"JEWELRY AND PARTS THEREOF, OF OTH PRECIOUS ME",1321.87,1423.44,1090.21,630.95
New Jersey,5,870332,PASS VEH COM-IG INT COM ENG > 1500 NOV 2500 C,19.68,5.58,3.79,576.34
New Jersey,6,300490,"MEDICAMENTS NESOI, MEASURED DOSES, RETAIL PK",498.08,529.74,552.71,554.66
New Jersey,7,711292,PLAT WST A SCRP NT CNTNG OTH PREC MTLS,732.74,868.26,658.85,529.33
New Jersey,8,847180,"AUTOMATIC DATA PROCESSING UNITS, N.E.S.O.I.",201.26,323.9,330.73,493.35
New Jersey,9,870323,PASS VEH SPK-IG INT COM RCPR P ENG >1500 NOV,879.47,613.34,322.54,492.46
New Jersey,10,720449,FERROUS WASTE & SCRAP NESOI,931.99,754.27,471.78,476.57
New Jersey,11,330499,"BEAUTY & SKIN CARE PREPARATION, NESOI",415.59,430.43,461.38,472.86
New Jersey,12,880330,"PARTS OF AIRPLANES OR HELICOPTERS, NESOI",269.2,374.02,424.28,454.81
New Jersey,13,300210,"ANTISERA, BLOOD FRACTIONS & IMMUNOLOGICAL PRO",271.86,254.08,386.3,398.53
New Jersey,14,847330,PARTS & ACCESSORIES FOR ADP MACHINES & UNITS,108.43,196.07,275.25,396.45
New Jersey,15,711021,"PALLADIUM, UNWROUGHT OR IN POWDER FORM",610.25,884.67,678.75,365.19
New Jersey,16,330300,PERFUMES AND TOILET WATERS,361.92,343.72,336.66,346.1
New Jersey,17,870324,PASS VEH SPK-IG INT COM RCPR P ENG > 3000 CC,607.87,621.28,437.85,304.7
New Jersey,18,490199,"PRINTED BOOKS, BROCHURES, ETC., NESOI",379.72,380.01,322.51,297.41
New Jersey,19,330290,"MIXTURES OF ODORIFEROUS SUBSTANCES, ETC. NESO",289.41,296.37,278.13,280.27
New Jersey,20,851762,MACH FOR RECP/CONVR/TRANS/REGN OF VOICE/IMAGE,194.88,281.45,296.94,270.16
New Jersey,21,330210,MIXTURES ODORIFEROUS SUBSTANCE USE FOOD/ DRIN,276.62,273.08,247.64,267.52
New Jersey,22,381121,ADDITIVE FOR LUB OIL CONT PETRO/BITUMINOUS MI,324.16,342.04,279.88,255.18
New Jersey,23,711011,"PLATINUM, UNWROUGHT OR POWDER",391.72,469.87,277.21,250.19
New Jersey,24,381512,SUPPORTED CATALYSTS W PREC METAL/PREC MTL COM,135.87,204.71,213.47,229.99
New Jersey,25,382200,"COMPOSITE DIAGNOSTIC/LAB REAGENTS, EXC PHARMA",236.33,203.73,181.4,225.38
New Mexico,0,0,World,2726.14,3801.61,3781.25,3631.62
New Mexico,0,25,Top 25,1370.38,2331.1,2715.97,2707.25
New Mexico,1,854231,"PROCESSORS AND CONTROLLERS, ELECTRONIC INTEG",789.14,836.62,1083.72,867.96
New Mexico,2,847330,PARTS & ACCESSORIES FOR ADP MACHINES & UNITS,10.11,495.25,795.39,668.99
New Mexico,3,852610,RADAR APPARATUS,0,254.29,0.15,141.3
New Mexico,4,930690,BOMB MINES OT AMMNTION PROJCTIONS ETC AND PAR,13.01,65.81,43.4,109.13
New Mexico,5,851762,MACH FOR RECP/CONVR/TRANS/REGN OF VOICE/IMAGE,7.17,42.38,103.97,94.82
New Mexico,6,901890,"INSTR & APPL F MEDICAL SURGICAL DENTAL VET, N",31.72,43.16,68.36,94.68
New Mexico,7,880000,"CIVILIAN AIRCRAFT, ENGINES, AND PARTS",92.09,100.29,59.56,84.26
New Mexico,8,854442,"ELEC CONDUCTORS, LT=1000 V, W/ CONNECTORS, NE",3.02,17.74,39.05,63.76
New Mexico,9,848180,TAPS COCKS ETC F PIPE VAT INC THERMO CONTROL,66.98,65.98,64.34,59.19
New Mexico,10,841330,"FUEL, LUB/COOLING MED PUMPS FOR INT COMB PIST",43.19,46.89,36.43,53.54
New Mexico,11,392690,"ARTICLES OF PLASTICS, NESOI",42.64,55.94,52.64,50.73
New Mexico,12,310490,"MINERAL OR CHEMICAL FERTILIZER, POTASSIC, NES",26.93,15.46,23.17,43.18
New Mexico,13,847170,"AUTOMATIC DATA PROCESSING STORAGE UNITS, N.E.",0.44,35.58,52.76,39.92
New Mexico,14,732690,ARTICLES OF IRON OR STEEL NESOI,31.82,36.18,34.44,37.29
New Mexico,15,851769,APP FOR THE TRANS/RECEP OF VOICE/IMAGES/DATA,21.72,26.8,26.12,35.77
New Mexico,16,40210,"MLK & CRM,CNTD,SWT,POWDR,GRAN/SOLIDS,NOV 1.5%",18.84,8.66,30.28,35.08
New Mexico,17,381800,"CHEM ELEM DOPED, USED IN ELECTRON, DISCS WAFE",28.22,24.91,28.94,30.01
New Mexico,18,853690,ELECT APPR F PRTCT TO ELECT CIRCT NOV 1000 V,31.83,30.84,32.9,28.49
New Mexico,19,80290,"NUTS NESOI, FRESH OR DRIED, SHELLED OR NOT",8.12,10.68,7.52,28.14
New Mexico,20,382490,"PRODUCTS AND RESIDUALS OF CHEMICAL INDUSTRY,",17.34,6.49,19.72,26.24
New Mexico,21,350220,"MILK ALBUMIN,INC CONCEN OF 2 OR MORE WHEY PRO",4,13.94,19.23,25.29
New Mexico,22,850110,ELECTRIC MOTORS OF AN OUTPUT NOT EXCEEDING 37,20.77,17.19,19.12,23.01
New Mexico,23,710692,"SILVER, SEMIMANUFACTURED",31.51,26.67,18.85,22.82
New Mexico,24,170230,"GLUCOSE (DEXTROSE), UNDER 20% FRUCTOSE IN DRY",8.37,26.12,25.79,22.1
New Mexico,25,854140,PHOTOSNSITVE SEMICNDCTR DVICE INC PHTVLTC CEL,21.42,27.24,30.13,21.57
Nevada,0,0,World,8701.08,7691.75,8666.46,9763.16
Nevada,0,25,Top 25,6551.65,5572.55,6796.15,7815.08
Nevada,1,710812,"GOLD, NONMONETARY, UNWROUGHT NESOI",3897.04,2798.28,3941.22,4591.66
Nevada,2,950430,GAMES COIN-/TOKEN-OPERATED EXC BOWLING ALLEY,550.68,396.2,443.66,573.5
Nevada,3,854239,"ELECTRONIC INTEGRATED CIRCUITS, NESOI",281.6,360.4,370.38,382.52
Nevada,4,260300,COPPER ORES AND CONCENTRATES,604.39,559.8,326.92,358.83
Nevada,5,710692,"SILVER, SEMIMANUFACTURED",1.81,49.1,5.94,280.53
Nevada,6,710239,"DIAMONDS, NONINDUSTRIAL, WORKED",274.37,292.3,403.06,256.93
Nevada,7,854231,"PROCESSORS AND CONTROLLERS, ELECTRONIC INTEG",116.72,159.75,172.19,194.37
Nevada,8,903180,"MEAS & CHECKNG INSTRUMENT, APPLIANCES & MACH",186.36,187.24,155.32,141.1
Nevada,9,880000,"CIVILIAN AIRCRAFT, ENGINES, AND PARTS",161.82,107.35,114.55,138.82
Nevada,10,711890,"COIN, NESOI",0.86,0.35,3.39,109.18
Nevada,11,841370,"CENTRIFUGAL PUMPS, NESOI",62.02,61.55,42.96,78.25
Nevada,12,90121,"COFFEE, ROASTED, NOT DECAFFEINATED",1.91,42.99,50.04,71.58
Nevada,13,854232,"MEMORIES, ELECTRONIC INTEGRATED CIRCUITS",54.66,88.29,82.87,70.14
Nevada,14,851712,PHONES FOR CELLULAR NTWKS OR FOR OTH WIRELESS,4.21,32.57,57.92,63.46
Nevada,15,300210,"ANTISERA, BLOOD FRACTIONS & IMMUNOLOGICAL PRO",0,0.06,9.71,60.61
Nevada,16,710691,"SILVER, UNWROUGHT NESOI",7.13,42.6,244.17,51.9
Nevada,17,854233,"AMPLIFIERS, ELECTRONIC INTEGRATED CIRCUITS",33.5,38.15,33.01,51.52
Nevada,18,854290,ELECTRONIC INTEGRATED CIRCUITS AND MCRSSMBLS,28.15,43.45,44.95,47.24
Nevada,19,854129,"TRANSISTORS, OTHER THAN PHOTOSENSITIVE, NESOI",31.02,29.64,27.85,45.44
Nevada,20,851762,MACH FOR RECP/CONVR/TRANS/REGN OF VOICE/IMAGE,20.44,23.84,28.59,44.62
Nevada,21,711319,"JEWELRY AND PARTS THEREOF, OF OTH PRECIOUS ME",60.45,69.2,74.31,44.22
Nevada,22,902290,X-RAY/HI TNSN GENR CNTR PNL & DSK EXM/TRTMNT,51.07,44.87,45.57,42.36
Nevada,23,854140,PHOTOSNSITVE SEMICNDCTR DVICE INC PHTVLTC CEL,40.31,52.79,50.97,42.23
Nevada,24,854110,DIODES EX PHOTOSENSITIVE OR LIGHT-EMITTING DI,29.47,33.46,30.16,40.67
Nevada,25,848180,TAPS COCKS ETC F PIPE VAT INC THERMO CONTROL,51.67,58.3,36.46,33.4
New York,0,0,World,86407.15,88834.33,83134.46,76720.21
New York,0,25,Top 25,44458.3,47713.38,44889.34,41204.66
New York,1,710239,"DIAMONDS, NONINDUSTRIAL, WORKED",12547.56,14421.25,12656.1,12440.16
New York,2,970110,"PAINTINGS, DRAWING AND PASTELS BY HAND",4594.73,6449.84,6976.22,6810.22
